{"adapter_timeout_seconds":60,"adapters":{"fixture-adapter":{"adapter_id":"fixture-adapter","adapter_version":"fixture.adapter/v1","bounded_arguments":[],"executable_identity":"sha256:eeeeeeeeeeeeeeeeeeeeeeeeeeeeeeeeeeeeeeeeeeeeeeeeeeeeeeeeeeeeeeee","protocol":"fixture.adapter/v1"}},"admission_digest":"sha256:510a62ba34e439fbd0fa5258f12edecc7299aeb052c229d95729ebe45fd799a8","budget_policy_ref":"nightshift-default-provider-reserve-v1","closeout_policy":"ALL_EXPLICIT_TERMINAL_OR_NOT_STARTED","log_custody_root":"/tmp/foreman-fixture/log","maximum_event_bytes":65536,"maximum_receipt_bytes":131072,"packet_digest":"sha256:ac6b42310384c00a6eaaf7b8565f9ae7009e073bfcaac1d170b50bb63c739743","profile_digest":"sha256:5591d3f34c2f2177e922506118b68c6008e217cf0e132f34e8cf7293847ad7f7","receipt_custody_root":"/tmp/foreman-fixture/receipts","schema":"nightshift.foreman-execution-profile/v2","work_items":{"dependent":{"adapter_id":"fixture-adapter","provider_model_class":"bounded","resource_lock_keys":["repository:dependent"],"workspace_identity":"workspace:dependent"},"root-a":{"adapter_id":"fixture-adapter","provider_model_class":"bounded","resource_lock_keys":["repository:shared"],"workspace_identity":"workspace:root-a"},"root-b":{"adapter_id":"fixture-adapter","provider_model_class":"bounded","resource_lock_keys":["repository:other"],"workspace_identity":"workspace:root-b"},"root-c":{"adapter_id":"fixture-adapter","provider_model_class":"bounded","resource_lock_keys":["repository:shared"],"workspace_identity":"workspace:root-c"}}}